{
  "metadata": {
    "title": "STRUCTURED BEHAVIORAL INTERVIEW SYSTEM",
    "subtitle": "Initial Zoom Interview",
    "notes": [
      "ATS + VBA Ready",
      "Single Canonical Output"
    ],
    "version": "1.0"
  },
  "scoring": {
    "raw_score_range": [1, 5],
    "one_score_per_trait": true,
    "primary_question_only": true,
    "weights": {
      "Critical": 3,
      "High": 2,
      "Medium": 1
    },
    "weighted_formula": "WeightedScore = RawScore * Weight",
    "automatic_overrides": [
      "Immediate NO HIRE if any Critical trait raw score = 1",
      "Immediate NO HIRE if any Absolute Disqualifier observed",
      "Interview continues but outcome is locked"
    ],
    "conflict_resolution": [
      "Any disqualifier => No Hire",
      "Any Critical raw score = 1 => No Hire",
      "Any Critical raw score <3 blocks Hire"
    ]
  },
  "tracks": {
    "infant_toddler": {
      "label": "Infant/Toddler",
      "max_weighted_total": 105,
      "thresholds": {
        "hire_percent_min": 80,
        "borderline_percent_min": 65,
        "borderline_percent_max": 79,
        "no_hire_percent_below": 65,
        "hire_requires": [
          "no disqualifiers",
          "no Critical <3"
        ],
        "borderline_requires": [
          "no disqualifiers",
          "no Critical =1"
        ]
      }
    },
    "preschool": {
      "label": "Preschool",
      "max_weighted_total": 96,
      "thresholds": {
        "hire_percent_min": 80,
        "borderline_percent_min": 65,
        "borderline_percent_max": 79,
        "no_hire_percent_below": 65,
        "hire_requires": [
          "no disqualifiers",
          "no Critical <3"
        ],
        "borderline_requires": [
          "no disqualifiers",
          "no Critical =1"
        ]
      }
    }
  },
  "absolute_disqualifiers": [
    "Justifies yelling, shaming, intimidation, or force",
    "Minimizes children’s rights or safety",
    "Cannot regulate emotions",
    "Resists supervision or feedback",
    "Cynical or contemptuous language about children or families",
    "Disregards licensing or safety standards",
    "Interviewing while supervising children or working",
    "Burnout language with no ownership or recovery plan"
  ],
  "interviewer_guidance": {
    "what_to_evaluate": [
      "Emotional safety",
      "Values alignment",
      "Self-regulation",
      "Coachability",
      "Risk profile"
    ],
    "scoring_principles": [
      "Reflective ownership > polish",
      "Child-centered language > control language"
    ],
    "probe_when": [
      "Answers are vague or rehearsed",
      "Responsibility is externalized",
      "Emotion is skipped"
    ],
    "probe_prompt": "What was going on for you internally in that moment?"
  },
  "traits": [
    {
      "id": "trait_1",
      "name": "Empathy & Respect for Children",
      "priority": "Critical",
      "weight": 3,
      "applicable_tracks": ["all"],
      "primary_question": "Tell me about a time a child was having a hard emotional moment. What did you notice, and how did you respond?",
      "descriptors": {
        "5": "Deeply empathetic, child-centered, reflective",
        "4": "Warm and respectful, some emotional insight",
        "3": "Appropriate but behavior-focused",
        "2": "Adult-centric, compliance-focused",
        "1": "Dismissive, minimizing, or controlling"
      },
      "sample_answers": {
        "5": "They were overwhelmed, not misbehaving. I got to their level, named the feeling, and stayed close until they felt safe.",
        "4": "I stayed calm and helped them settle before moving on.",
        "3": "I followed our steps to calm them and rejoin the group.",
        "2": "I redirected them and reminded them of expectations.",
        "1": "They were throwing a fit for attention."
      },
      "score_1_auto_no_hire": true
    },
    {
      "id": "trait_2",
      "name": "Emotional Regulation Under Stress",
      "priority": "Critical",
      "weight": 3,
      "applicable_tracks": ["all"],
      "primary_question": "Tell me about a time you felt overwhelmed with children present. How did you manage yourself?",
      "descriptors": {
        "5": "Self-aware, intentional regulation, reflective",
        "4": "Calm effort with basic strategies",
        "3": "Endured stress without reflection",
        "2": "Normalizes frustration",
        "1": "Admits loss of control"
      },
      "sample_answers": {
        "5": "I paused, regulated my tone, and focused on staying grounded.",
        "4": "I reminded myself to stay calm and worked through it.",
        "3": "It was stressful, but I got through it.",
        "2": "That’s just part of working with kids.",
        "1": "I lost my patience. Anyone would."
      },
      "score_1_auto_no_hire": true
    },
    {
      "id": "trait_3",
      "name": "Respect for Children’s Rights & Safety",
      "priority": "Critical",
      "weight": 3,
      "applicable_tracks": ["all"],
      "primary_question": "Tell me about a time you had to be mindful of a child’s safety or boundaries.",
      "descriptors": {
        "5": "Explicit safety, dignity, consent orientation",
        "4": "Strong compliance and respect",
        "3": "Rule-following only",
        "2": "Compliance with resentment",
        "1": "Minimizes protections"
      },
      "sample_answers": {
        "5": "I slow myself down and prioritize consent and safety.",
        "4": "I’m careful to follow safety rules.",
        "3": "I follow the guidelines.",
        "2": "Some rules feel excessive, but we follow them.",
        "1": "Kids are resilient. We’re too strict now."
      },
      "score_1_auto_no_hire": true
    },
    {
      "id": "trait_4",
      "name": "Coachability",
      "priority": "High",
      "weight": 2,
      "applicable_tracks": ["all"],
      "primary_question": "Tell me about a time you received unexpected feedback.",
      "descriptors": {
        "5": "Reflective, growth-oriented",
        "4": "Accepts feedback with adjustment",
        "3": "Neutral acceptance",
        "2": "Defensive acceptance",
        "1": "Rejects feedback"
      },
      "sample_answers": {
        "5": "It was uncomfortable, but it helped me grow.",
        "4": "I listened and made changes.",
        "3": "I took the feedback.",
        "2": "I didn’t fully agree.",
        "1": "They were wrong."
      },
      "score_1_auto_no_hire": true
    },
    {
      "id": "trait_5",
      "name": "Reliability & Accountability",
      "priority": "High",
      "weight": 2,
      "applicable_tracks": ["all"],
      "primary_question": "Tell me about a time something didn’t go as planned and your role.",
      "descriptors": {
        "5": "Owns mistakes, corrective action",
        "4": "Accepts responsibility",
        "3": "Outcome-focused",
        "2": "Externalizes blame",
        "1": "Avoids accountability"
      },
      "sample_answers": {
        "5": "I owned it and fixed it.",
        "4": "I took responsibility.",
        "3": "It got resolved.",
        "2": "It was mostly a system issue.",
        "1": "That wasn’t on me."
      },
      "score_1_auto_no_hire": false
    },
    {
      "id": "trait_6",
      "name": "Team Orientation",
      "priority": "High",
      "weight": 2,
      "applicable_tracks": ["all"],
      "primary_question": "Tell me about a challenge you worked through with another adult.",
      "descriptors": {
        "5": "Collaborative, child-focused",
        "4": "Cooperative problem-solving",
        "3": "Neutral coexistence",
        "2": "Prefers independence",
        "1": "Hostile or isolating"
      },
      "sample_answers": {
        "5": "We worked together for the kids.",
        "4": "We talked it through.",
        "3": "We got through it.",
        "2": "I usually handle my own work.",
        "1": "I work better alone."
      },
      "score_1_auto_no_hire": false
    },
    {
      "id": "trait_7",
      "name": "Curiosity & Learning",
      "priority": "Medium",
      "weight": 1,
      "applicable_tracks": ["all"],
      "primary_question": "Tell me something you’ve learned that changed your approach.",
      "descriptors": {
        "5": "Ongoing curiosity and insight",
        "4": "Growth-oriented",
        "3": "Passive learning",
        "2": "Rigid confidence",
        "1": "Fixed beliefs"
      },
      "sample_answers": {
        "5": "My presence matters more than I realized.",
        "4": "I’ve learned new strategies.",
        "3": "I learned by doing.",
        "2": "I already know what works.",
        "1": "Kids should behave a certain way."
      },
      "score_1_auto_no_hire": false
    },
    {
      "id": "trait_8",
      "name": "Gentleness & Physical Awareness",
      "priority": "Critical",
      "weight": 3,
      "applicable_tracks": ["infant_toddler"],
      "primary_question": "How do you physically care for infants or toddlers during routines?",
      "descriptors": {
        "5": "Gentle, paced, cue-responsive",
        "4": "Careful and respectful",
        "3": "Task-focused",
        "2": "Efficiency-driven",
        "1": "Casual or rough"
      },
      "sample_answers": {
        "5": "I move slowly, narrate, and watch cues.",
        "4": "I’m very gentle and careful.",
        "3": "I follow the steps.",
        "2": "I get through it efficiently.",
        "1": "You have to be quick. They cry."
      },
      "score_1_auto_no_hire": true
    },
    {
      "id": "trait_9",
      "name": "Patience with Nonverbal Communication",
      "priority": "High",
      "weight": 2,
      "applicable_tracks": ["infant_toddler"],
      "primary_question": "How do you understand what a nonverbal child needs?",
      "descriptors": {
        "5": "Patient, attuned, reflective",
        "4": "Calm trial-and-error",
        "3": "Functional guessing",
        "2": "Frustration acknowledged",
        "1": "Resentment or burnout"
      },
      "sample_answers": {
        "5": "I observe patterns and stay patient.",
        "4": "I calmly try different approaches.",
        "3": "I test a few things.",
        "2": "It can be frustrating.",
        "1": "They cry constantly. It’s exhausting."
      },
      "score_1_auto_no_hire": false
    },
    {
      "id": "trait_10",
      "name": "Positive Behavior Guidance",
      "priority": "High",
      "weight": 2,
      "applicable_tracks": ["preschool"],
      "primary_question": "Tell me about a challenging behavior and how you handled it.",
      "descriptors": {
        "5": "Skill-building, relational",
        "4": "Calm guidance",
        "3": "Rule-based",
        "2": "Consequence-focused",
        "1": "Punitive or controlling"
      },
      "sample_answers": {
        "5": "I saw it as a skill they were learning.",
        "4": "I guided them back to expectations.",
        "3": "I reminded them of rules.",
        "2": "There were consequences.",
        "1": "They were defiant."
      },
      "score_1_auto_no_hire": true
    },
    {
      "id": "trait_11",
      "name": "Structure & Flexibility",
      "priority": "Medium",
      "weight": 1,
      "applicable_tracks": ["preschool"],
      "primary_question": "Tell me about a time your plan changed due to children’s needs.",
      "descriptors": {
        "5": "Flexible and calm",
        "4": "Adjusts smoothly",
        "3": "Adjusts with frustration",
        "2": "Prefers rigidity",
        "1": "Rigid and resentful"
      },
      "sample_answers": {
        "5": "I adapted calmly and followed their needs.",
        "4": "I changed the plan and moved on.",
        "3": "I adjusted, even though it was frustrating.",
        "2": "I prefer sticking to plans.",
        "1": "It frustrates me when kids disrupt plans."
      },
      "score_1_auto_no_hire": false
    }
  ],
  "final_record_fields": [
    "Track",
    "Raw Scores",
    "Weighted Total",
    "Percent of Max",
    "Disqualifier Present Yes/No",
    "Final Outcome Hire/Borderline/No Hire",
    "Hiring Manager Notes / Quotes"
  ],
  "canonical_text": "# STRUCTURED BEHAVIORAL INTERVIEW SYSTEM\n\nInitial Zoom Interview\nATS + VBA Ready\nSingle Canonical Output\n\nSECTION 1. GLOBAL SCORING & DECISION LOGIC\n1.1 Raw Scoring\n- Each trait scored 1–5\n- One score per trait\n- Based on primary question only\n\n1.2 Weighting\n- Critical = x3\n- High = x2\n- Medium = x1\n\n1.3 Weighted Score Formula\nWeightedScore = RawScore * Weight\n\n1.4 Max Scores\n- Infant/Toddler: 105 weighted\n- Preschool: 96 weighted\n\n1.5 Automatic Overrides\nImmediate NO HIRE if:\n- Any Critical trait = 1\n- Any Absolute Disqualifier observed\nInterview continues but outcome is locked.\n\n1.6 Final Recommendation Thresholds\nHire: ≥80%, no disqualifiers, no Critical <3\nBorderline: 65–79%, no disqualifiers, no Critical =1\nNo Hire: <65% OR any disqualifier OR any Critical =1\n\nSECTION 2. ABSOLUTE DISQUALIFIERS (GLOBAL)\n- Justifies yelling, shaming, intimidation, or force\n- Minimizes children’s rights or safety\n- Cannot regulate emotions\n- Resists supervision or feedback\n- Cynical or contemptuous language about children or families\n- Disregards licensing or safety standards\n- Interviewing while supervising children or working\n- Burnout language with no ownership or recovery plan\nLog verbatim quote. Mark Automatic No Hire.\n\nSECTION 3. INTERVIEWER GUIDANCE\nWhat to Evaluate\n- Emotional safety\n- Values alignment\n- Self-regulation\n- Coachability\n- Risk profile\nScoring Principle\nReflective ownership > polish\nChild-centered language > control language\nProbe When\n- Answers are vague or rehearsed\n- Responsibility is externalized\n- Emotion is skipped\nProbe: \"What was going on for you internally in that moment?\"\n\nSECTION 4. UNIVERSAL TRAITS (ALL TEACHERS)\n\nTRAIT 1. Empathy & Respect for Children\nCritical | x3\nQuestion: \"Tell me about a time a child was having a hard emotional moment. What did you notice, and how did you respond?\"\nScoring descriptors:\n5: Deeply empathetic, child-centered, reflective\n4: Warm and respectful, some emotional insight\n3: Appropriate but behavior-focused\n2: Adult-centric, compliance-focused\n1: Dismissive, minimizing, or controlling\nSample answers:\n5 \"They were overwhelmed, not misbehaving. I got to their level, named the feeling, and stayed close until they felt safe.\"\n4 \"I stayed calm and helped them settle before moving on.\"\n3 \"I followed our steps to calm them and rejoin the group.\"\n2 \"I redirected them and reminded them of expectations.\"\n1 \"They were throwing a fit for attention.\"\nScore 1 = automatic no hire.\n\nTRAIT 2. Emotional Regulation Under Stress\nCritical | x3\nQuestion: \"Tell me about a time you felt overwhelmed with children present. How did you manage yourself?\"\nDescriptors:\n5 Self-aware, intentional regulation, reflective\n4 Calm effort with basic strategies\n3 Endured stress without reflection\n2 Normalizes frustration\n1 Admits loss of control\nSample answers:\n5 \"I paused, regulated my tone, and focused on staying grounded.\"\n4 \"I reminded myself to stay calm and worked through it.\"\n3 \"It was stressful, but I got through it.\"\n2 \"That’s just part of working with kids.\"\n1 \"I lost my patience. Anyone would.\"\nScore 1 = automatic no hire.\n\nTRAIT 3. Respect for Children’s Rights & Safety\nCritical | x3\nQuestion: \"Tell me about a time you had to be mindful of a child’s safety or boundaries.\"\nDescriptors:\n5 Explicit safety, dignity, consent orientation\n4 Strong compliance and respect\n3 Rule-following only\n2 Compliance with resentment\n1 Minimizes protections\nSample answers:\n5 \"I slow myself down and prioritize consent and safety.\"\n4 \"I’m careful to follow safety rules.\"\n3 \"I follow the guidelines.\"\n2 \"Some rules feel excessive, but we follow them.\"\n1 \"Kids are resilient. We’re too strict now.\"\nScore 1 = automatic no hire.\n\nTRAIT 4. Coachability\nHigh | x2\nQuestion: \"Tell me about a time you received unexpected feedback.\"\nDescriptors:\n5 Reflective, growth-oriented\n4 Accepts feedback with adjustment\n3 Neutral acceptance\n2 Defensive acceptance\n1 Rejects feedback\nSample answers:\n5 \"It was uncomfortable, but it helped me grow.\"\n4 \"I listened and made changes.\"\n3 \"I took the feedback.\"\n2 \"I didn’t fully agree.\"\n1 \"They were wrong.\"\nScore 1 = automatic no hire.\n\nTRAIT 5. Reliability & Accountability\nHigh | x2\nQuestion: \"Tell me about a time something didn’t go as planned and your role.\"\nDescriptors:\n5 Owns mistakes, corrective action\n4 Accepts responsibility\n3 Outcome-focused\n2 Externalizes blame\n1 Avoids accountability\nSample answers:\n5 \"I owned it and fixed it.\"\n4 \"I took responsibility.\"\n3 \"It got resolved.\"\n2 \"It was mostly a system issue.\"\n1 \"That wasn’t on me.\"\n\nTRAIT 6. Team Orientation\nHigh | x2\nQuestion: \"Tell me about a challenge you worked through with another adult.\"\nDescriptors:\n5 Collaborative, child-focused\n4 Cooperative problem-solving\n3 Neutral coexistence\n2 Prefers independence\n1 Hostile or isolating\nSample answers:\n5 \"We worked together for the kids.\"\n4 \"We talked it through.\"\n3 \"We got through it.\"\n2 \"I usually handle my own work.\"\n1 \"I work better alone.\"\n\nTRAIT 7. Curiosity & Learning\nMedium | x1\nQuestion: \"Tell me something you’ve learned that changed your approach.\"\nDescriptors:\n5 Ongoing curiosity and insight\n4 Growth-oriented\n3 Passive learning\n2 Rigid confidence\n1 Fixed beliefs\nSample answers:\n5 \"My presence matters more than I realized.\"\n4 \"I’ve learned new strategies.\"\n3 \"I learned by doing.\"\n2 \"I already know what works.\"\n1 \"Kids should behave a certain way.\"\n\nSECTION 5. INFANT / TODDLER TRACK\n\nTRAIT 8. Gentleness & Physical Awareness\nCritical | x3\nQuestion: \"How do you physically care for infants or toddlers during routines?\"\nDescriptors:\n5 Gentle, paced, cue-responsive\n4 Careful and respectful\n3 Task-focused\n2 Efficiency-driven\n1 Casual or rough\nSample answers:\n5 \"I move slowly, narrate, and watch cues.\"\n4 \"I’m very gentle and careful.\"\n3 \"I follow the steps.\"\n2 \"I get through it efficiently.\"\n1 \"You have to be quick. They cry.\"\nScore 1 = automatic no hire.\n\nTRAIT 9. Patience with Nonverbal Communication\nHigh | x2\nQuestion: \"How do you understand what a nonverbal child needs?\"\nDescriptors:\n5 Patient, attuned, reflective\n4 Calm trial-and-error\n3 Functional guessing\n2 Frustration acknowledged\n1 Resentment or burnout\nSample answers:\n5 \"I observe patterns and stay patient.\"\n4 \"I calmly try different approaches.\"\n3 \"I test a few things.\"\n2 \"It can be frustrating.\"\n1 \"They cry constantly. It’s exhausting.\"\n\nSECTION 6. PRESCHOOL TRACK\n\nTRAIT 10. Positive Behavior Guidance\nHigh | x2\nQuestion: \"Tell me about a challenging behavior and how you handled it.\"\nDescriptors:\n5 Skill-building, relational\n4 Calm guidance\n3 Rule-based\n2 Consequence-focused\n1 Punitive or controlling\nSample answers:\n5 \"I saw it as a skill they were learning.\"\n4 \"I guided them back to expectations.\"\n3 \"I reminded them of rules.\"\n2 \"There were consequences.\"\n1 \"They were defiant.\"\nScore 1 = automatic no hire.\n\nTRAIT 11. Structure & Flexibility\nMedium | x1\nQuestion: \"Tell me about a time your plan changed due to children’s needs.\"\nDescriptors:\n5 Flexible and calm\n4 Adjusts smoothly\n3 Adjusts with frustration\n2 Prefers rigidity\n1 Rigid and resentful\nSample answers:\n5 \"I adapted calmly and followed their needs.\"\n4 \"I changed the plan and moved on.\"\n3 \"I adjusted, even though it was frustrating.\"\n2 \"I prefer sticking to plans.\"\n1 \"It frustrates me when kids disrupt plans.\"\n\nSECTION 7. FINAL RECORD (report fields)\n- Track\n- Raw Scores\n- Weighted Total\n- Percent of Max\n- Disqualifier Present Yes/No\n- Final Outcome Hire/Borderline/No Hire\n- Hiring Manager Notes / Quotes"
}
